<?xml version="1.0" encoding="UTF-8"?>
<?xml-stylesheet href="inv_style.xsl" type="text/xsl"?>
<inventory-management xmlns:xsi="http://www.w3.org/2001/XMLSchema-instance" xsi:noNamespaceSchemaLocation="inv_validator.xsd">

    <storage>
        <pid>1</pid>
        <pname>oil</pname>
        <p_postion>cr</p_postion>
        <q_instock>52</q_instock>

    </storage>
    <storage>
        <pid>2</pid>
        <pname>break_pad</pname>
        <p_postion>cr</p_postion>
        <q_instock>53</q_instock>

    </storage>
    
    <vendor>
        <phoneno>9802123</phoneno>
        <id>6</id>
        <name>rahul rao</name>
    </vendor>
    <vendor>
        <phoneno>98028971</phoneno>
        <id>7</id>
        <name>sharath</name>
    </vendor>
    
    <products>
        <pquantity>50</pquantity>
        <pname>spanner</pname>
        <pid>55</pid>
    </products>
    
</inventory-management>
